Name,Price,Image
 Alpha Spirit Complementos Snacks de Pollo en Monodosis para Perro - Pack 16 x 35Grs,10.25,https://www.petsonic.com/12024-large_default/snacks-de-pollo-en-monodosis-para-perro.jpg
 Alpha Spirit Complementos Snacks de Queso en Monodosis para Perro - Pack 16 x 35Grs,10.25,https://www.petsonic.com/12025-large_default/snacks-de-queso-en-monodosis-para-perro.jpg
 Alpha Spirit Complementos Snacks de Higado en Monodosis para Perro - Pack 16 x 35Grs,10.25,https://www.petsonic.com/12026-large_default/snacks-de-higado-en-monodosis-para-perro.jpg
 Alpha Spirit Complementos Snacks de Pescado en Monodosis para Perro - Pack 16 x 35Grs,10.25,https://www.petsonic.com/12027-large_default/snacks-de-pescado-en-monodosis-para-perro.jpg
 Alpha Spirit Complementos Snacks de Pato en Monodosis para Perro - Pack 16 x 35Grs,10.25,https://www.petsonic.com/12028-large_default/snacks-de-pato-en-monodosis-para-perro.jpg
 Kong Pasta Easy Treat para Perro - 0.236 L,5.82,https://www.petsonic.com/13278-large_default/kong-pasta-easy-treat-para-perros.jpg
 Purina Pro Plan Adventuros Mini Sticks de Búfalo - Pack 6 sobres de 90gr,6.44,https://www.petsonic.com/14127-large_default/purina-pro-plan-adventuros-mini-sticks-bufalo-para-perros.jpg
 Purina Pro Plan Adventuros Strips Venado - Pack 6 sobres de 90gr,6.44,https://www.petsonic.com/14128-large_default/purina-pro-plan-adventuros-strips-venado-para-perros.jpg
 Purina Pro Plan Adventuros Sticks de Búfalo - 120 gr,6.44,https://www.petsonic.com/14130-large_default/purina-pro-plan-adventuros-sticks-bufalo-para-perros.jpg
 Purina Pro Plan Adventuros Sticks de Búfalo - 6 Unidades.,7.00,https://www.petsonic.com/14130-large_default/purina-pro-plan-adventuros-sticks-bufalo-para-perros.jpg
 Purina Pro Plan Biscuits Dental Bar 150gr. - 6 Unidades.,15.18,https://www.petsonic.com/13407-large_default/purina-pro-plan-biscuits-dental-bar-150gr-para-perros.jpg
 Purina Pro Plan Biscuits Light 400gr. - 4 Unidades,10.81,https://www.petsonic.com/13408-large_default/purina-pro-plan-biscuits-light-400gr-para-perros.jpg
 Acana Treat Free Run Duck 35 gr premios ultra calidad para perros - 1 Unidad.,5.68,https://www.petsonic.com/13837-large_default/treat-free-run-duck-35-gr.jpg
 Acana Treat Grass-Fed Lamb 35 gr premios ultra calidad para perros - 1 Unidad.,5.68,https://www.petsonic.com/13838-large_default/treat-grass-fed-lamb-35-gr.jpg
 Acana Treat Yorkshire Pork 35 gr premios ultra calidad para perros - 1 Unidad.,5.68,https://www.petsonic.com/13840-large_default/treat-yorkshire-pork-35-gr.jpg
 Orijen Free Run Duck dog treats premios para perro 100% proteina y nada mas - 42.5 Gr,6.62,https://www.petsonic.com/19383-large_default/orijen-treat-free-run-duck-42-5-gr-para-perros.jpg
 Orijen Regional dog Treats 42.5 gr premios para perro 100% proteina y nada mas - 1 Unidad.,5.68,https://www.petsonic.com/13414-large_default/regional-treats-42-5-gr.jpg
 Orijen Regional dog Treats 42.5 gr premios para perro 100% proteina y nada mas - 6 Unidades.,6.17,https://www.petsonic.com/13414-large_default/regional-treats-42-5-gr.jpg
 Orijen Wild Boar dog treats premios para perro 100% proteina y nada mas - 42.5 Gr,5.48,https://www.petsonic.com/20625-large_default/orijen-treat-wild-board-56-gr-para-perros.jpg
 Orijen Original dog treats premios para perro 100% proteina y nada mas - 42.5 Gr,5.68,https://www.petsonic.com/9782-large_default/orijen-treats-original-56gr-para-perros.jpg
 Advance Puppy Snack premios para cachorros - Pack 7 sobres 150Grs.,19.32,https://www.petsonic.com/18854-large_default/affinity-advance-puppy-snack-para-perros.jpg
 Advance Dental Care Stick Mini Pack 4 x 360Grs higiene dental para perros - 28 Unidades,29.00,https://www.petsonic.com/18855-large_default/affinity-advance-dental-care-stick-mini-para-perros.jpg
 Advance Dental Care Stick Medium Pack higiene dental para perros - 180 Gr,33.17,https://www.petsonic.com/18858-large_default/affinity-advance-dental-care-stick-medium-para-perros.jpg
 Advance Dental Care Stick Medium Pack higiene dental para perros - 13 Unidades.,35.29,https://www.petsonic.com/18858-large_default/affinity-advance-dental-care-stick-medium-para-perros.jpg
 Advance Hypoallergenic Snack premios para perros alergicos - Pack 7 sobres 150Grs.,17.42,https://www.petsonic.com/18860-large_default/affinity-advance-hypoallergenic-snack-para-perros.jpg
 Advance Appetite Control Snack para perros. Con efecto saciante - Pack 7 sobres 150Grs.,18.11,https://www.petsonic.com/18862-large_default/affinity-advance-appetite-control-snack-para-perros.jpg
 Advance Articular Snack premios condroprotectores para perro - 1 x 14 packs de 155 gr,36.20,https://www.petsonic.com/18859-large_default/affinity-advance-articular-snack-para-perros.jpg
 Advance Sensitive Snack premios para gatos sensibles cuidado intestinal - Pack 7 sobres 150Grs.,14.52,https://www.petsonic.com/18863-large_default/sensitive-snack.jpg
 Advance +7 Años Snack senior para perros mayores - Pack 7 sobres 150Grs.,15.49,https://www.petsonic.com/18861-large_default/siete-anos-snack.jpg
 Bayer Limpiador Dental Masticable para Perros - 140 gr,6.99,https://www.petsonic.com/15895-large_default/bayer-limpiador-dental-masticable-para-perros.jpg
 Purina Pro Plan Snack Dentalife para Perro X-Small - 5 Unidades x 69gr,9.15,https://www.petsonic.com/15574-large_default/snack-dentalife-para-perro-x-small.jpg
 Purina Pro Plan Snack Dentalife para Perro X-Small - 5 Unidades x 207gr,9.95,https://www.petsonic.com/15574-large_default/snack-dentalife-para-perro-x-small.jpg
 Purina Pro Plan Snack Dentalife para Perros Mini - 5 unidades x 115Grs,11.03,https://www.petsonic.com/11184-large_default/purina-pro-plan-snack-dentalife-mini-para-perros.jpg
 Purina Pro Plan Snack Dentalife para Perros Mini - 4 Unidades x 345gr,11.99,https://www.petsonic.com/11184-large_default/purina-pro-plan-snack-dentalife-mini-para-perros.jpg
 Purina Pro Plan Snack Dentalife para Perros Medianos - 5 unidades x 115Grs,10.99,https://www.petsonic.com/11186-large_default/purina-pro-plan-snack-dentalife-medianos-para-perros.jpg
 Purina Pro Plan Snack Dentalife para Perros Medianos - 5 unidades x 345Grs,11.95,https://www.petsonic.com/11186-large_default/purina-pro-plan-snack-dentalife-medianos-para-perros.jpg
 Purina Pro Plan Snack Dentalife para Perros Grandes - 5 Unidades x 142gr,8.56,https://www.petsonic.com/11188-large_default/purina-pro-plan-snack-dentalife-grandes-para-perros.jpg
 Purina Pro Plan Snack Dentalife para Perros Grandes - 5 Unidades x 426gr,9.30,https://www.petsonic.com/11188-large_default/purina-pro-plan-snack-dentalife-grandes-para-perros.jpg
 Dentastix para perros pequeños -10kg. Pedrigree barritas dentales - Caja 28 barritas ( 7 x4),8.49,https://www.petsonic.com/10731-large_default/pedigree-dentastix-5-10-kg-sticks-dentales-para-perros.jpg
 Dentastix para perros pequeños -10kg. Pedrigree barritas dentales - Caja 56 barritas ( 8x7),13.98,https://www.petsonic.com/10731-large_default/pedigree-dentastix-5-10-kg-sticks-dentales-para-perros.jpg
 Dentastix para perros pequeños -10kg. Pedrigree barritas dentales - Caja 112 barritas (16x7),23.96,https://www.petsonic.com/10731-large_default/pedigree-dentastix-5-10-kg-sticks-dentales-para-perros.jpg
 Dentastix para perros medianos 10-25kg. Pedrigree barritas dentales - Caja 28 barritas ( 7 x4),9.49,https://www.petsonic.com/10732-large_default/pedigree-dentastix-10-25kg-sticks-dentales-para-perros.jpg
 Dentastix para perros medianos 10-25kg. Pedrigree barritas dentales - Caja 56 barritas ( 8x7),15.98,https://www.petsonic.com/10732-large_default/pedigree-dentastix-10-25kg-sticks-dentales-para-perros.jpg
 Dentastix para perros medianos 10-25kg. Pedrigree barritas dentales - Caja 112 barritas (16x7),27.96,https://www.petsonic.com/10732-large_default/pedigree-dentastix-10-25kg-sticks-dentales-para-perros.jpg
 Dentastix para perros grandes +25kg. Pedrigree barritas dentales - Caja 28 barritas ( 7 x4),11.99,https://www.petsonic.com/15896-large_default/pedigree-dentastix-25-kg-para-perros.jpg
 Dentastix para perros grandes +25kg. Pedrigree barritas dentales - Caja 56 barritas ( 8x7),20.98,https://www.petsonic.com/15896-large_default/pedigree-dentastix-25-kg-para-perros.jpg
 Dentastix para perros grandes +25kg. Pedrigree barritas dentales - Caja 112 barritas (16x7),37.96,https://www.petsonic.com/15896-large_default/pedigree-dentastix-25-kg-para-perros.jpg
 Vetnova Glyco-flex l Snacks para Perro - 120 Comprimidos,57.74,https://www.petsonic.com/11857-large_default/glyco-flex-l-snacks-para-perro.jpg
 Vetnova Glyco-flex ll Snacks para Perro - 60 Comprimidos,37.52,https://www.petsonic.com/11858-large_default/vetnova-glyco-flex-ll-snacks-para-perro.jpg
 Vetnova Glyco-flex ll Snacks para Perro - 120 Comprimidos,39.49,https://www.petsonic.com/11858-large_default/vetnova-glyco-flex-ll-snacks-para-perro.jpg
 Vetnova Glyco-flex ll Snacks para Gatos y Perros Pequeños - 60 Comprimidos,34.49,https://www.petsonic.com/11859-large_default/vetnova-glyco-flex-l-snacks-para-gatos-y-perros-pequenos.jpg
 Vetnova Glyco-flex III Snacks para Perro - 30 Comprimidos,32.40,https://www.petsonic.com/11863-large_default/vetnova-glyco-flex-lll-snacks-para-perro.jpg
 Vetnova Glyco-flex III Snacks para Perro - 60 Comprimidos,34.10,https://www.petsonic.com/11863-large_default/vetnova-glyco-flex-lll-snacks-para-perro.jpg
 Vetnova Glyco-flex III Snacks para Perro - 120 Comprimidos,53.35,https://www.petsonic.com/11863-large_default/vetnova-glyco-flex-lll-snacks-para-perro.jpg
 Vetnova Glyco-flex lll Snacks para Perro Mini - 60 Comprimidos,35.56,https://www.petsonic.com/11862-large_default/vetnova-glyco-flex-lll-snacks-para-perro-mini.jpg
 Vetnova Multiva Active para Perro - 45 Comprimidos,17.77,https://www.petsonic.com/11868-large_default/vetnova-multiva-active-para-perro.jpg
 Vetnova Multiva Calming para Gatos y Perros Pequeños - 21 Comprimidos,10.45,https://www.petsonic.com/11869-large_default/vetnoca-multiva-calming-para-gato-y-perros-pequenos.jpg
 Vetnova Multiva Calming para Perros Medianos y Grandes - 21 Comprimidos,17.77,https://www.petsonic.com/11870-large_default/vetnova-multiva-calming-para-perros-medianos-y-grandes.jpg
 Vetnova Multiva Motion para Perro - 60 Comprimidos,17.77,https://www.petsonic.com/11872-large_default/vetnova-multiva-motion-para-perro.jpg
 Specific Snack Healthy Treats Mini para Perro - 1 unidad de 300gr,2.62,https://www.petsonic.com/14914-large_default/snack-healthy-treats-mini-para-perro.jpg
 Specific Snack Healthy Treats para Perro - 1 unidad de 300gr,2.76,https://www.petsonic.com/14915-large_default/snack-healthy-treats-para-perro.jpg
 Specific Snack Healthy Treats Hypoallergenic para Perro - 1 unidad de 300gr,3.27,https://www.petsonic.com/14916-large_default/snack-healthy-treats-hypoallergenic-para-perro.jpg
 virbac VeggieDent Fresh para Perro - XS,5.23,https://www.petsonic.com/17253-large_default/virbac-veggiedent-fresh-para-perro.jpg
 virbac VeggieDent Fresh para Perro - S,5.50,https://www.petsonic.com/17253-large_default/virbac-veggiedent-fresh-para-perro.jpg
 virbac VeggieDent Fresh para Perro - M,5.75,https://www.petsonic.com/17253-large_default/virbac-veggiedent-fresh-para-perro.jpg
 virbac VeggieDent Fresh para Perro - L,6.05,https://www.petsonic.com/17253-large_default/virbac-veggiedent-fresh-para-perro.jpg
 Carnilove Snack Crunchy Cordero y Arándanos premio crujiente para perro Lamb & Cranberries - 6 Unidades.,13.49,https://www.petsonic.com/19061-large_default/snack-crunchy-cordero-arandanos.jpg
 Carnilove Snack Crunchy Avestruz y Moras premio crujiente para perro Ostrich & Blackberries - 6 Unidades.,13.49,https://www.petsonic.com/19062-large_default/snack-crunchy-avestruz-moras.jpg
 Carnilove Snack Crunchy Salmón con Arándanos premio crujiente para perro Salmon & Blueberries - 6 Unidades.,13.49,https://www.petsonic.com/19064-large_default/snack-crunchy-salmon-arandanos.jpg
 Carnilove Snack Crunchy Caballa con Frambuesas premio crujiente para perro Mackerel & Raspberries - 6 Unidades.,13.49,https://www.petsonic.com/19065-large_default/snack-crunchy-caballa-frambuesas.jpg
 Orijen Black Angus Beef dog treats premios para perro 100% proteina y nada mas - 42.5 Gr,6.24,https://www.petsonic.com/20620-large_default/orijen-black-angus-beef-dog-treats-premios-para-perros.jpg
 Orijen Regional Red dog treats premios para perro 100% proteina y nada mas - 42.5 Gr,5.21,https://www.petsonic.com/20623-large_default/orijen-regional-red-dog-treats-premios-para-perros.jpg
 Orijen Tundra dog treats premios para perro 100% proteina y nada mas - 42.5 Gr,6.42,https://www.petsonic.com/20624-large_default/tundra-dog-treats-premios-para-perros.jpg
 Adventuros maxi steaks Wild Buffalo 70grs - 1 Unidad.,3.63,https://www.petsonic.com/20644-large_default/adventuros-maxi-steaks-wild-buffalo-70grs.jpg
 Juguete Hueso Natural Pollo 40Grs 6 unidades Comestible 6 unidades Ferplast - XS,4.49,https://www.petsonic.com/21448-large_default/juguete-hueso-natural-pollo-40grs-6-unidades-comestible-6-unidades-ferplast.jpg
 Juguete Hueso Natural Pollo 40Grs 6 unidades Comestible 6 unidades Ferplast - S,4.59,https://www.petsonic.com/21448-large_default/juguete-hueso-natural-pollo-40grs-6-unidades-comestible-6-unidades-ferplast.jpg
 Juguete Goodbite Natural Cordero Comestible 1 unidad Ferplast - 70 Grs,3.69,https://www.petsonic.com/21426-large_default/juguete-goodbite-natural-cordero-comestible-4-unidades-ferplast.jpg
 Juguete Goodbite Natural Pollo Comestible 1 unidad Ferplast - 70 Grs,3.69,https://www.petsonic.com/21427-large_default/juguete-goodbite-natural-pollo-comestible-4-unidades-ferplast.jpg
 Juguete Goodbite Natural Cereal S 40Gr Comestible 1 unidad Ferplast - S,2.39,https://www.petsonic.com/21433-large_default/juguete-goodbite-natural-cereal-s-40gr-comestible-6-unidades-ferplast.jpg
 Juguete Goodbite Natural Cordero 40Grs 1 unidad Comestible Ferplast - XS,2.29,https://www.petsonic.com/21434-large_default/juguete-goodbite-natural-cordero-40grs-6-unidades-comestible-ferplast.jpg
 Juguete Goodbite Natural Cordero 40Grs 1 unidad Comestible Ferplast - S,2.39,https://www.petsonic.com/21434-large_default/juguete-goodbite-natural-cordero-40grs-6-unidades-comestible-ferplast.jpg
 Juguete Goodbite Natural Jamon 1 Unidad Comestible Ferplast - S,2.39,https://www.petsonic.com/21438-large_default/juguete-goodbite-natural-jamon-6-unidades-comestible-ferplast.jpg
 Juguete Goodbite Natural Pollo 2 Unidades Comestible Ferplast - XS,2.29,https://www.petsonic.com/21440-large_default/juguete-goodbite-natural-pollo-6-unidades-comestible-ferplast.jpg
 Juguete Goodbite Natural Ternera 2 Unidades Comestible Ferplast - XS,2.29,https://www.petsonic.com/21442-large_default/juguete-goodbite-natural-ternera-6-unidades-comestible-ferplast.jpg
 Juguete Goodbite Natural Ternera 2 Unidades Comestible Ferplast - S,2.39,https://www.petsonic.com/21442-large_default/juguete-goodbite-natural-ternera-6-unidades-comestible-ferplast.jpg
 Juguete Hueso Natural Cereal S 40Grs Comestible 6 unidades Ferplast - S,4.59,https://www.petsonic.com/21444-large_default/juguete-hueso-natural-cereal-s-40grs-comestible-6-unidades-ferplast.jpg
 Juguete Hueso Natural Cordero S 40Grs Comestible 6 unidades Ferplast - S,4.59,https://www.petsonic.com/21445-large_default/juguete-hueso-natural-cordero-s-40grs-comestible-6-unidades-ferplast.jpg
 Juguete Hueso Natural Jamon 40Grs 6 unidades Comestible 6 unidades Ferplast - XS,4.49,https://www.petsonic.com/21446-large_default/juguete-hueso-natural-jamon-40grs-6-unidades-comestible-6-unidades-ferplast.jpg
 Juguete Hueso Natural Jamon 40Grs 6 unidades Comestible 6 unidades Ferplast - S,4.59,https://www.petsonic.com/21446-large_default/juguete-hueso-natural-jamon-40grs-6-unidades-comestible-6-unidades-ferplast.jpg
